{
    "filenames": {
        "edit_feedback_file": "__CER_TOOL_TEMP_COMMENT__.txt",
        "feedback_filename_prefix": "Feedback",
        "tmp_folder": "__CER_TOOL_TEMP_FOLDER{}__"
    },
    "initials": "???",
    "moodle": {
        "feedback_footer": [
            "<strong>- {}</strong>"
        ],
        "file_upload_limit_bytes": 24999500,
        "submission_keyword": "assignsubmission_file"
    },
    "pex": {
        "docker_group_name": "cer-tool",
        "html_magic_comment": "<!--%%%-->",
        "text_divider": "%"
    }
}